{
  "rule_id": "mpd2021_mod_2022.res_plotted.ground_coverage_pct.1500_2250",
  "title": "Max ground coverage 50% for plots above 1500 to 2250 sqm (residential plotted table, row 7)",
  "parameter": "ground_coverage_pct",
  "applicability": {
    "land_use": "residential_plotted",
    "authority": "DDA",
    "conditions": [
      {
        "fact": "plot_area_sqm",
        "op": "between",
        "value": [
          1500,
          2250
        ]
      }
    ]
  },
  "output": {
    "type": "scalar",
    "value": 50,
    "unit": "pct"
  },
  "effective_from": "2014-11-26",
  "effective_to": null,
  "supersedes": null,
  "citations": [
    {
      "doc_id": "mpd2021_mod_2022",
      "clause": "Development control norms for residential plots (table)",
      "page": 63,
      "bbox": [
        0.2812,
        0.2507,
        0.8468,
        0.265
      ],
      "original_text": "7 Above 1500 to 2250 50 200 12",
      "original_lang": "en",
      "translated_text": null
    }
  ],
  "verification": {
    "status": "verified",
    "verified_by": "Indicodes review",
    "verified_on": "2026-06-17",
    "method": "llm_extraction_v1",
    "confidence": 0.9
  },
  "notes": "Within footnote 2 bracket (rows 5–10 modified vide S.O. 2983(E) dated 26-11-2014). Prose 'Above 1500 to 2250': 1500 belongs to lower band, 2250 to this band — verifier to confirm [1500,2250)."
}
