{
  "rule_id": "mpd2047.res_plotted.max_height_m.without_stilt",
  "title": "Max building height 15m (Ground+3 habitable floors) in plots without stilt parking, clause (iv)",
  "parameter": "max_height_m",
  "applicability": {
    "land_use": "residential_plotted",
    "authority": "DDA",
    "conditions": [
      {
        "fact": "stilt_parking",
        "op": "eq",
        "value": false
      }
    ]
  },
  "output": {
    "type": "scalar",
    "value": 15,
    "unit": "m"
  },
  "effective_from": "2026-08-20",
  "effective_to": null,
  "supersedes": "ubbl2016_compendium_2020.res_plotted.max_height_m.no_stilt",
  "citations": [
    {
      "doc_id": "mpd2047",
      "clause": "(iv)",
      "page": 177,
      "bbox": [
        0.1101,
        0.4821,
        0.8837,
        0.5357
      ],
      "original_text": "Maximum height of the building shall be 15m (i.e. Ground+3 habitable floors) in plots without stilt parking. In plots with stilt parking height of the building shall be upto 17.5m (i.e. stilt + 4 habitable floors).",
      "original_lang": "en",
      "translated_text": null
    }
  ],
  "verification": {
    "status": "verified",
    "verified_by": "Indicodes review",
    "verified_on": "2026-10-15",
    "method": "llm_extraction_v1",
    "confidence": 0.92
  },
  "notes": "15m corresponds to Ground+3 habitable floors, without stilt parking.",
  "user_caveat": "MPD-2047 states this as Ground + 3 habitable floors (Other controls (iv), p.177)."
}
