{
  "rule_id": "mpd2021_mod_2022.res_plotted.dwelling_units.1000_1500",
  "title": "Max 9 dwelling units for plots above 1000 to 1500 sqm (residential plotted table, row 6)",
  "parameter": "dwelling_units",
  "applicability": {
    "land_use": "residential_plotted",
    "authority": "DDA",
    "conditions": [
      {
        "fact": "plot_area_sqm",
        "op": "between",
        "value": [
          1000,
          1500
        ]
      }
    ]
  },
  "output": {
    "type": "scalar",
    "value": 9,
    "unit": "count"
  },
  "effective_from": "2014-11-26",
  "effective_to": null,
  "supersedes": null,
  "citations": [
    {
      "doc_id": "mpd2021_mod_2022",
      "clause": "Development control norms for residential plots (table)",
      "page": 63,
      "bbox": [
        0.2812,
        0.2321,
        0.8411,
        0.2463
      ],
      "original_text": "6 Above 1000 to 1500 50 200 9",
      "original_lang": "en",
      "translated_text": null
    }
  ],
  "verification": {
    "status": "verified",
    "verified_by": "Indicodes review",
    "verified_on": "2026-06-17",
    "method": "llm_extraction_v1",
    "confidence": 0.9
  },
  "notes": "Within footnote 2 bracket (rows 5–10 modified vide S.O. 2983(E) dated 26-11-2014). Prose 'Above 1000 to 1500': 1000 belongs to lower band, 1500 to this band — verifier to confirm [1000,1500). T&C (i): additional DUs subject to levy.",
  "user_caveat": "Terms & conditions (i): additional dwelling units are subject to levy."
}
