{
  "rule_id": "mpd2047.res_plotted.setback_side_m.2000_10000",
  "title": "Side setback 6 m for plots above 2,000 up to 10,000 sqm (MPD-2047 Table 7.3, row 5)",
  "parameter": "setback_side_m",
  "applicability": {
    "land_use": "residential_plotted",
    "authority": "DDA",
    "conditions": [
      {
        "fact": "plot_area_sqm",
        "op": "between",
        "value": [
          2000,
          10000
        ]
      }
    ]
  },
  "output": {
    "type": "scalar",
    "value": 6,
    "unit": "m"
  },
  "effective_from": "2026-08-20",
  "effective_to": null,
  "supersedes": "ubbl2016_compendium_2020.res_plotted.setback_side_m.2000_10000",
  "citations": [
    {
      "doc_id": "mpd2047",
      "clause": "Table 7.3 (Minimum Setback Norms for Plotted Housing), row 5",
      "page": 178,
      "bbox": [
        0.1889,
        0.4307,
        0.8307,
        0.4498
      ],
      "original_text": "5. Above 2000 and up to 10,000 9 6 6 6",
      "original_lang": "en",
      "translated_text": null
    }
  ],
  "verification": {
    "status": "verified",
    "verified_by": "Indicodes review",
    "verified_on": "2026-10-15",
    "method": "pdf_text_extraction_v1",
    "confidence": null
  },
  "notes": "Read from the gazette text layer, p.178. Row: '5. Above 2000 and up to 10,000 9 6 6 6' (Front, Rear, Side 1, Side 2). Same as UBBL p.154 (6 m, ubbl2016_compendium_2020.res_plotted.setback_side_m.2000_10000). effective_from is the date of S.O. 4597(E), as for Table 7.2.",
  "user_caveat": "MPD-2047 Table 7.3 (a): if the permissible ground coverage is not achieved with these setbacks (under specific circumstances), the setbacks of the immediately preceding category may be permitted. Not modelled; check with the sanctioning authority."
}
