{
  "rule_id": "mpd2047.res_plotted.far.above_3750",
  "title": "Max FAR 200 for plots above 3750 sqm (MPD-2047 Table 7.2, row 10)",
  "parameter": "far",
  "applicability": {
    "land_use": "residential_plotted",
    "authority": "DDA",
    "conditions": [
      {
        "fact": "plot_area_sqm",
        "op": "gt",
        "value": 3750
      }
    ]
  },
  "output": {
    "type": "scalar",
    "value": 200,
    "unit": "far_x100"
  },
  "effective_from": "2026-08-20",
  "effective_to": null,
  "supersedes": "mpd2021_mod_2022.res_plotted.far.above_3750",
  "citations": [
    {
      "doc_id": "mpd2047",
      "clause": "Table 7.2 (DCN for Plotted Housing), row 10",
      "page": 177,
      "bbox": [
        0.2576,
        0.2848,
        0.8408,
        0.3038
      ],
      "original_text": "10. Above 3750 50 200 10",
      "original_lang": "en",
      "translated_text": null
    }
  ],
  "verification": {
    "status": "verified",
    "verified_by": "Indicodes review",
    "verified_on": "2026-10-11",
    "method": "llm_extraction_v1",
    "confidence": 0.9
  },
  "notes": "Read from the gazette text layer, p.177. Same as MPD-2021 (200, mpd2021_mod_2022.res_plotted.far.above_3750). effective_from is the date of S.O. 4597(E) (notified 20.08.2026); the plan states no other commencement date. Band conditions copied from the MPD-2021 row it supersedes — the two tables print the same bands."
}
