{
  "rule_id": "mpd2047.res_plotted.setback_rear_m.upto_100",
  "title": "Rear setback 0 m for plots up to 100 sqm (MPD-2047 Table 7.3, row 1)",
  "parameter": "setback_rear_m",
  "applicability": {
    "land_use": "residential_plotted",
    "authority": "DDA",
    "conditions": [
      {
        "fact": "plot_area_sqm",
        "op": "lte",
        "value": 100
      }
    ]
  },
  "output": {
    "type": "scalar",
    "value": 0,
    "unit": "m"
  },
  "effective_from": "2026-08-20",
  "effective_to": null,
  "supersedes": "ubbl2016_compendium_2020.res_plotted.setback_rear_m.upto_100",
  "citations": [
    {
      "doc_id": "mpd2047",
      "clause": "Table 7.3 (Minimum Setback Norms for Plotted Housing), row 1",
      "page": 178,
      "bbox": [
        0.1889,
        0.3496,
        0.8319,
        0.3698
      ],
      "original_text": "1. Up to 100 0 0 0 0",
      "original_lang": "en",
      "translated_text": null
    }
  ],
  "verification": {
    "status": "verified",
    "verified_by": "Indicodes review",
    "verified_on": "2026-10-15",
    "method": "pdf_text_extraction_v1",
    "confidence": null
  },
  "notes": "Read from the gazette text layer, p.178. Row: '1. Up to 100 0 0 0 0' (Front, Rear, Side 1, Side 2). Same as UBBL p.154 (0 m, ubbl2016_compendium_2020.res_plotted.setback_rear_m.upto_100). MPD-2047 prints row 1 as 'Up to 100' where UBBL prints 'Below 100', so from 2026-08-20 a plot of exactly 100 m² falls in this row; before that date it stays the declared source band gap. effective_from is the date of S.O. 4597(E), as for Table 7.2.",
  "user_caveat": "MPD-2047 Table 7.3 (a): if the permissible ground coverage is not achieved with these setbacks (under specific circumstances), the setbacks of the immediately preceding category may be permitted. Not modelled; check with the sanctioning authority."
}
