{
  "rule_id": "mpd2047.res_plotted.far.2250_3000",
  "title": "Max FAR 200 for plots above 2250 up to 3000 sqm (MPD-2047 Table 7.2, row 8)",
  "parameter": "far",
  "applicability": {
    "land_use": "residential_plotted",
    "authority": "DDA",
    "conditions": [
      {
        "fact": "plot_area_sqm",
        "op": "between",
        "value": [
          2250,
          3000
        ]
      }
    ]
  },
  "output": {
    "type": "scalar",
    "value": 200,
    "unit": "far_x100"
  },
  "effective_from": "2026-08-20",
  "effective_to": null,
  "supersedes": "mpd2021_mod_2022.res_plotted.far.2250_3000",
  "citations": [
    {
      "doc_id": "mpd2047",
      "clause": "Table 7.2 (DCN for Plotted Housing), row 8",
      "page": 177,
      "bbox": [
        0.2576,
        0.2443,
        0.8408,
        0.2633
      ],
      "original_text": "8. Above 2250 up to 3000 50 200 10",
      "original_lang": "en",
      "translated_text": null
    }
  ],
  "verification": {
    "status": "verified",
    "verified_by": "Indicodes review",
    "verified_on": "2026-10-11",
    "method": "llm_extraction_v1",
    "confidence": 0.9
  },
  "notes": "Read from the gazette text layer, p.177. Same as MPD-2021 (200, mpd2021_mod_2022.res_plotted.far.2250_3000). effective_from is the date of S.O. 4597(E) (notified 20.08.2026); the plan states no other commencement date. Band conditions copied from the MPD-2021 row it supersedes — the two tables print the same bands."
}
